{
  "$schema": "../../schemas/battle-profile.schema.json",
  "schema_version": 1,
  "id": "aggro_nightmare",
  "name": "无限制快攻梦魇",
  "description": "地城快梦规则：起手有一费则全留，否则全换；额外能量点可用就用；整手规划尽量用满费用，同等费用按卡牌优先级出牌；自动普通进化并优先疾驰随从。",
  "strategy": "aggro_nightmare",
  "play_mode": "maximize_energy",
  "deck": [
    { "card_id": "10501110", "copies": 3 }, { "card_id": "10251120", "copies": 3 },
    { "card_id": "10851120", "copies": 3 }, { "card_id": "10601110", "copies": 3 },
    { "card_id": "10051130", "copies": 2 }, { "card_id": "10651110", "copies": 3 },
    { "card_id": "10751120", "copies": 3 }, { "card_id": "10851130", "copies": 3 },
    { "card_id": "10951110", "copies": 3 }, { "card_id": "10951120", "copies": 3 },
    { "card_id": "10153310", "copies": 3 }, { "card_id": "10552310", "copies": 3 },
    { "card_id": "10151110", "copies": 2 }, { "card_id": "10153140", "copies": 1 },
    { "card_id": "10253120", "copies": 2 }
  ],
  "cards": {
    "10501110": { "play_priority": -1000, "target": { "type": "none" }, "max_uses_per_turn": 3 },
    "10251120": { "play_priority": 610, "target": { "type": "none" }, "max_uses_per_turn": 3 },
    "10851120": { "play_priority": 610, "target": { "type": "none" }, "max_uses_per_turn": 3 },
    "10601110": { "play_priority": 620, "target": { "type": "none" }, "max_uses_per_turn": 3 },
    "10051130": { "play_priority": 620, "target": { "type": "none" }, "max_uses_per_turn": 2 },
    "10651110": { "play_priority": 620, "target": { "type": "none" }, "max_uses_per_turn": 3 },
    "10751120": { "play_priority": 620, "target": { "type": "none" }, "max_uses_per_turn": 3 },
    "10851130": { "play_priority": 620, "target": { "type": "none" }, "max_uses_per_turn": 3 },
    "10951110": { "play_priority": 620, "target": { "type": "none" }, "max_uses_per_turn": 3 },
    "10951120": { "play_priority": 620, "target": { "type": "none" }, "max_uses_per_turn": 3 },
    "10153310": { "play_priority": 300, "target": { "type": "enemy_leader" }, "max_uses_per_turn": 3 },
    "10552310": { "play_priority": 299, "target": { "type": "none" }, "max_uses_per_turn": 3 },
    "10151110": { "play_priority": 630, "target": { "type": "none" }, "max_uses_per_turn": 2 },
    "10153140": { "play_priority": 630, "target": { "type": "none" }, "max_uses_per_turn": 1 },
    "10253120": { "play_priority": 640, "target": { "type": "none" }, "max_uses_per_turn": 2 },
    "90051130": { "play_priority": 610, "target": { "type": "none" }, "max_uses_per_turn": 5 },
    "90051120": { "play_priority": 610, "target": { "type": "none" }, "max_uses_per_turn": 5 }
  },
  "combos": [],
  "attack": { "clear_ward": true, "otherwise": "enemy_leader", "attacker_order": "lowest_attack_first", "resume_play": true },
  "evolution": {
    "enabled": true,
    "prefer_can_attack": true,
    "after_play": true,
    "card_priority": ["90051130", "10253120"],
    "type_order": ["normal"]
  },
  "mulligan": {
    "enabled": true,
    "keep": ["10501110", "10251120", "10851120"],
    "keep_all_if_any_kept": true
  },
  "safety": { "max_actions_per_turn": 30, "max_retries_per_action": 1, "no_progress_limit": 3 }
}
